{
  "schema_version": "1.0",
  "lead_id": "example-co",
  "business_facts": {
    "services": ["Ремонт квартир под ключ", "Дизайн интерьера"],
    "usp_existing": ["Фиксированная смета", "Гарантия на работы", "Опыт с 1997 года"],
    "audience": "Владельцы квартир, выбирающие подрядчика для ремонта"
  },
  "findings": [
    {
      "id": "trust-01",
      "category": "конверсия",
      "claim": "На первом экране одновременно несколько разных акцентов и призывов к действию, из‑за этого быстро не считывается главный следующий шаг.",
      "evidence": "capture/desktop.png",
      "impact": "Часть людей уходит обратно в поиск, потому что не понимает за пару секунд, что делать дальше и почему вам можно доверять.",
      "severity": "high"
    },
    {
      "id": "trust-02",
      "category": "доверие",
      "claim": "Сильные доказательства надежности (опыт, гарантии, выполненные объекты) есть, но их легко не заметить в первые секунды знакомства.",
      "evidence": "capture/desktop.png",
      "impact": "Компания выглядит менее убедительно, чем является, и это снижает готовность оставить заявку без сравнения с конкурентами.",
      "severity": "high"
    },
    {
      "id": "content-01",
      "category": "контент",
      "claim": "В тексте много общих формулировок про ремонт, но человеку приходится самому искать короткий ответ: чем вы отличаетесь и кому вы точно подходите.",
      "evidence": "capture/text.txt#L12-L18",
      "impact": "Если отличия не считываются быстро, часть посетителей начинает сравнивать компании по цене и уходит за более понятным предложением.",
      "severity": "medium"
    },
    {
      "id": "mobile-01",
      "category": "мобильная",
      "claim": "На мобильном устройстве путь до ключевой информации и формы обращения получается длинным из‑за количества блоков и прокрутки.",
      "evidence": "capture/mobile.png",
      "impact": "Часть мобильного трафика теряется по дороге: люди устают искать важное и закрывают страницу, не дойдя до заявки.",
      "severity": "medium"
    }
  ],
  "money_loss_summary": "Компания выглядит сильнее, чем показывает сайт в первые секунды: человеку сложно быстро понять следующий шаг и сразу увидеть доказательства надежности. Из‑за этого часть посетителей уходит к тем, у кого ответ проще и яснее. Если собрать путь клиента вокруг одного понятного действия и быстрее показать ключевые факты, обращений может стать больше без увеличения рекламного бюджета.",
  "tone": "дружелюбно-деловой"
}